{
  "schema_version": "2.0.0",
  "locale": "pt-BR",
  "classes": [
    {
      "id": "intrusion",
      "label": "Intrusão"
    },
    {
      "id": "decryption",
      "label": "Decifrador"
    },
    {
      "id": "detection_alarm",
      "label": "Detecção/Alarme"
    },
    {
      "id": "anti_system",
      "label": "Anti-sistema"
    },
    {
      "id": "evasion_stealth",
      "label": "Evasão/Furtividade"
    },
    {
      "id": "protection",
      "label": "Proteção"
    },
    {
      "id": "anti_program",
      "label": "Anti-programa"
    },
    {
      "id": "anti_personnel",
      "label": "Anti-pessoal"
    },
    {
      "id": "controller",
      "label": "Controlador"
    },
    {
      "id": "utility",
      "label": "Utilitário"
    },
    {
      "id": "demon",
      "label": "Demônio"
    },
    {
      "id": "multi_purpose",
      "label": "Multiuso"
    },
    {
      "id": "daemon",
      "label": "Daemon"
    },
    {
      "id": "systemware",
      "label": "Systemware"
    },
    {
      "id": "upgraded_datawall",
      "label": "Muro de Dados Aprimorado"
    },
    {
      "id": "transportation",
      "label": "Transporte"
    },
    {
      "id": "rache_special",
      "label": "Especial de Rache"
    },
    {
      "id": "misc_anti_program",
      "label": "Anti-programa Diverso"
    },
    {
      "id": "base_link",
      "label": "Link de Base"
    },
    {
      "id": "virus",
      "label": "Vírus"
    },
    {
      "id": "ambush",
      "label": "Emboscada"
    },
    {
      "id": "datawall",
      "label": "Muro de Dados"
    },
    {
      "id": "code_gate",
      "label": "Portão de Acesso"
    },
    {
      "id": "special",
      "label": "Especial"
    }
  ],
  "programs": [
    {
      "class_ids": [
        "intrusion"
      ],
      "memory_model": {
        "kind": "fixed",
        "amount": 1
      },
      "price_model": {
        "kind": "fixed",
        "amount": 400
      },
      "platform": "cyberdeck",
      "loadable": true,
      "availability": "retail",
      "catalog_scope": "standard",
      "id": "hammer",
      "class_id": "intrusion",
      "name": "Martelo",
      "strength": {
        "base": 4
      },
      "memory": 1,
      "price": 400,
      "effect": "Reduz a Força de um Muro de Dados em 2D6 por acerto e alerta defesas num raio de 10 espaços.",
      "icon": "Um martelo vermelho brilhante.",
      "source": {
        "book": "Cyberpunk 2020 Core Rulebook",
        "pages": "137-141"
      }
    },
    {
      "class_ids": [
        "intrusion"
      ],
      "memory_model": {
        "kind": "fixed",
        "amount": 2
      },
      "price_model": {
        "kind": "fixed",
        "amount": 360
      },
      "platform": "cyberdeck",
      "loadable": true,
      "availability": "retail",
      "catalog_scope": "standard",
      "id": "jackhammer",
      "class_id": "intrusion",
      "name": "Britadeira",
      "strength": {
        "base": 2
      },
      "memory": 2,
      "price": 360,
      "effect": "Um ataque de intrusão mais silencioso que reduz a Força de um Muro de Dados em 1D6 por acerto.",
      "icon": "Uma britadeira vermelha disparando raios brancos de energia.",
      "source": {
        "book": "Cyberpunk 2020 Core Rulebook",
        "pages": "137-141"
      }
    },
    {
      "class_ids": [
        "intrusion"
      ],
      "memory_model": {
        "kind": "fixed",
        "amount": 5
      },
      "price_model": {
        "kind": "fixed",
        "amount": 660
      },
      "platform": "cyberdeck",
      "loadable": true,
      "availability": "retail",
      "catalog_scope": "standard",
      "id": "worm",
      "class_id": "intrusion",
      "name": "Minhoca",
      "strength": {
        "base": 2
      },
      "memory": 5,
      "price": 660,
      "effect": "Abre um Muro de Código ou Dados por dentro em dois turnos sem disparar o alarme.",
      "icon": "Uma minhoca robótica dourada com olhos verde-neon.",
      "source": {
        "book": "Cyberpunk 2020 Core Rulebook",
        "pages": "137-141"
      }
    },
    {
      "class_ids": [
        "decryption"
      ],
      "memory_model": {
        "kind": "fixed",
        "amount": 2
      },
      "price_model": {
        "kind": "fixed",
        "amount": 380
      },
      "platform": "cyberdeck",
      "loadable": true,
      "availability": "retail",
      "catalog_scope": "standard",
      "id": "codecracker",
      "class_id": "decryption",
      "name": "Quebra-Códigos",
      "strength": {
        "base": 3
      },
      "memory": 2,
      "price": 380,
      "effect": "Rompe Portões de Acesso desmontando sua estrutura de programa.",
      "icon": "Um fino feixe branco atravessando o portão.",
      "source": {
        "book": "Cyberpunk 2020 Core Rulebook",
        "pages": "137-141"
      }
    },
    {
      "class_ids": [
        "decryption"
      ],
      "memory_model": {
        "kind": "fixed",
        "amount": 2
      },
      "price_model": {
        "kind": "fixed",
        "amount": 400
      },
      "platform": "cyberdeck",
      "loadable": true,
      "availability": "retail",
      "catalog_scope": "standard",
      "id": "wizards_book",
      "class_id": "decryption",
      "name": "Grimório",
      "strength": {
        "base": 4,
        "situational": [
          {
            "value": 6,
            "when": "contra Portões de Acesso"
          }
        ]
      },
      "memory": 2,
      "price": 400,
      "effect": "Testa bilhões de chaves; sua Força sobe para 6 contra Portões de Acesso.",
      "icon": "Uma corrente de símbolos brancos brilhantes.",
      "source": {
        "book": "Cyberpunk 2020 Core Rulebook",
        "pages": "137-141"
      }
    },
    {
      "class_ids": [
        "decryption"
      ],
      "memory_model": {
        "kind": "fixed",
        "amount": 3
      },
      "price_model": {
        "kind": "fixed",
        "amount": 560
      },
      "platform": "cyberdeck",
      "loadable": true,
      "availability": "retail",
      "catalog_scope": "standard",
      "id": "raffles",
      "class_id": "decryption",
      "name": "Sorteio",
      "strength": {
        "base": 5
      },
      "memory": 3,
      "price": 560,
      "effect": "Usa uma sequência de perguntas para revelar senhas de Portões de Acesso e Fechaduras de Arquivo.",
      "icon": "Um jovem elegante com roupas de festa do início dos anos 1990.",
      "source": {
        "book": "Cyberpunk 2020 Core Rulebook",
        "pages": "137-141"
      }
    },
    {
      "class_ids": [
        "detection_alarm"
      ],
      "memory_model": {
        "kind": "fixed",
        "amount": 5
      },
      "price_model": {
        "kind": "fixed",
        "amount": 610
      },
      "platform": "cyberdeck",
      "loadable": true,
      "availability": "retail",
      "catalog_scope": "standard",
      "id": "watchdog",
      "class_id": "detection_alarm",
      "name": "Cão de Guarda",
      "strength": {
        "base": 4
      },
      "memory": 5,
      "price": 610,
      "effect": "Detecta entradas ilegais e alerta seu dono ou um alarme externo.",
      "icon": "Um grande cachorro preto de metal com olhos vermelhos.",
      "source": {
        "book": "Cyberpunk 2020 Core Rulebook",
        "pages": "137-141"
      }
    },
    {
      "class_ids": [
        "detection_alarm"
      ],
      "memory_model": {
        "kind": "fixed",
        "amount": 5
      },
      "price_model": {
        "kind": "fixed",
        "amount": 700
      },
      "platform": "cyberdeck",
      "loadable": true,
      "availability": "retail",
      "catalog_scope": "standard",
      "id": "bloodhound",
      "class_id": "detection_alarm",
      "name": "Cão de Caça",
      "strength": {
        "base": 3
      },
      "memory": 5,
      "price": 700,
      "effect": "Detecta um intruso, rastreia a entrada até a origem e alerta seu dono.",
      "icon": "Um cão cinza-metálico com olhos azuis e coleira de neon.",
      "source": {
        "book": "Cyberpunk 2020 Core Rulebook",
        "pages": "137-141"
      }
    },
    {
      "class_ids": [
        "detection_alarm"
      ],
      "memory_model": {
        "kind": "fixed",
        "amount": 6
      },
      "price_model": {
        "kind": "fixed",
        "amount": 780
      },
      "platform": "cyberdeck",
      "loadable": true,
      "availability": "retail",
      "catalog_scope": "standard",
      "id": "pit_bull",
      "class_id": "detection_alarm",
      "name": "Pit Bull",
      "strength": {
        "base": 2
      },
      "memory": 6,
      "price": 780,
      "effect": "Detecta e rastreia um intruso, depois corta repetidamente aquela linha de acesso.",
      "icon": "Um cão compacto de aço com olhos vermelhos e coleira de neon vermelho.",
      "source": {
        "book": "Cyberpunk 2020 Core Rulebook",
        "pages": "137-141"
      }
    },
    {
      "class_ids": [
        "detection_alarm"
      ],
      "memory_model": {
        "kind": "fixed",
        "amount": 1
      },
      "price_model": {
        "kind": "fixed",
        "amount": 280
      },
      "platform": "cyberdeck",
      "loadable": true,
      "availability": "retail",
      "catalog_scope": "standard",
      "id": "see_ya",
      "class_id": "detection_alarm",
      "name": "Te Vejo",
      "strength": {
        "base": 3
      },
      "memory": 1,
      "price": 280,
      "effect": "Revela ÍCONES invisíveis dentro de uma subgrade.",
      "icon": "Uma tela prateada de brilho difuso.",
      "source": {
        "book": "Cyberpunk 2020 Core Rulebook",
        "pages": "137-141"
      }
    },
    {
      "class_ids": [
        "detection_alarm"
      ],
      "memory_model": {
        "kind": "fixed",
        "amount": 1
      },
      "price_model": {
        "kind": "fixed",
        "amount": 280
      },
      "platform": "cyberdeck",
      "loadable": true,
      "availability": "retail",